[
  {
    "id": "cloudflare-2019-07-02-waf-regex",
    "title": "Cloudflare global outage from a WAF regex with catastrophic backtracking",
    "date": "2019-07-02",
    "affected_services": ["edge-proxy", "waf"],
    "service_types": ["proxy", "cdn", "security"],
    "symptoms": ["global 502 errors", "CPU pinned at 100% across the edge", "27 minute outage"],
    "symptom_type": "resource-exhaustion",
    "error_signatures": ["HTTP 502", "CPU utilization 100%", "worker unresponsive"],
    "error_pattern_category": "cpu-saturation",
    "root_cause": "A newly deployed WAF managed rule contained a regular expression with catastrophic backtracking. It ran on every request and drove CPU to 100% globally. A prior refactor had removed the safeguard that limited regex CPU cost, and because it was a security update it skipped the usual gradual rollout.",
    "fix": "Global kill switch disabled the WAF to recover CPU, then the offending rule was reverted. Follow-ups: re-add CPU limits on regex evaluation, and route emergency security rules through staged rollout with monitoring.",
    "source_url": "https://blog.cloudflare.com/details-of-the-cloudflare-outage-on-july-2-2019/"
  },
  {
    "id": "cloudflare-2020-07-17-backbone-config",
    "title": "Cloudflare outage from a backbone configuration change misrouting traffic",
    "date": "2020-07-17",
    "affected_services": ["backbone-network", "edge-proxy"],
    "service_types": ["network", "proxy", "cdn"],
    "symptoms": ["elevated latency", "traffic collapse onto one location", "regional unreachability"],
    "symptom_type": "latency",
    "error_signatures": ["packet loss", "congestion", "increased response time"],
    "error_pattern_category": "network-congestion",
    "root_cause": "A configuration change intended for a single Atlanta router leaked more broadly and caused all traffic across the backbone to be sent to Atlanta, overwhelming that path and collapsing connectivity for much of the US and Europe.",
    "fix": "Rolled back the backbone configuration and drained/rebalanced traffic. Added stronger config validation and blast-radius limits for backbone changes.",
    "source_url": "https://blog.cloudflare.com/cloudflare-outage-on-july-17-2020/"
  },
  {
    "id": "cloudflare-2022-06-21-bgp-prefix-order",
    "title": "Cloudflare outage from a BGP prefix ordering change disabling 19 data centers",
    "date": "2022-06-21",
    "affected_services": ["edge-network", "bgp"],
    "service_types": ["network", "cdn", "proxy"],
    "symptoms": ["19 data centers offline", "widespread 5xx", "partial global impact"],
    "symptom_type": "error-rate",
    "error_signatures": ["BGP withdrawal", "HTTP 500", "routes missing"],
    "error_pattern_category": "bgp-misconfiguration",
    "root_cause": "A change to the ordering of BGP prefix advertisements during a network topology migration caused the busiest 19 data centers to stop announcing routes, taking them offline.",
    "fix": "Reverted the network configuration to restore prefix advertisements. Introduced better staged rollout and review for BGP/topology changes.",
    "source_url": "https://blog.cloudflare.com/cloudflare-outage-on-june-21-2022/"
  },
  {
    "id": "cloudflare-2023-01-24-service-token",
    "title": "Cloudflare control-plane outage from a service token management code error",
    "date": "2023-01-24",
    "affected_services": ["control-plane", "workers", "zero-trust"],
    "service_types": ["api", "security"],
    "symptoms": ["control plane errors for 121 minutes", "dashboard/API failures"],
    "symptom_type": "error-rate",
    "error_signatures": ["HTTP 5xx on API", "auth/token errors"],
    "error_pattern_category": "bad-deployment",
    "root_cause": "A code change in service token management contained an error that disabled parts of the control plane (Workers, Zero Trust, CDN configuration APIs) for about two hours.",
    "fix": "Rolled back the change and restored the control plane. Added tests and safeguards around token management code paths.",
    "source_url": "https://blog.cloudflare.com/cloudflare-incident-on-january-24th-2023/"
  },
  {
    "id": "cloudflare-2023-11-02-control-plane-power",
    "title": "Cloudflare control plane and analytics outage from a data center power failure",
    "date": "2023-11-02",
    "affected_services": ["control-plane", "analytics", "logging"],
    "service_types": ["api", "storage", "compute"],
    "symptoms": ["control plane unavailable", "analytics/logging degraded", "multi-hour impact"],
    "symptom_type": "crash",
    "error_signatures": ["services unreachable", "database primaries down", "failover incomplete"],
    "error_pattern_category": "power-loss",
    "root_cause": "A power failure at a third-party (Flexential) data center hosting core control-plane services, combined with insufficient redundancy and dependencies that did not fail over cleanly, took down the control plane and analytics while the edge kept serving traffic.",
    "fix": "Restored power and services, then re-architected for higher availability across data centers and reduced hidden single-facility dependencies.",
    "source_url": "https://blog.cloudflare.com/post-mortem-on-cloudflare-control-plane-and-analytics-outage/"
  },
  {
    "id": "fastly-2021-06-08-latent-config-bug",
    "title": "Fastly global CDN outage from a latent software bug triggered by a config change",
    "date": "2021-06-08",
    "affected_services": ["cdn-edge"],
    "service_types": ["cdn", "proxy"],
    "symptoms": ["global 503 errors", "widespread site unavailability"],
    "symptom_type": "error-rate",
    "error_signatures": ["HTTP 503", "edge nodes returning errors"],
    "error_pattern_category": "bad-deployment",
    "root_cause": "A software deployment weeks earlier introduced a latent bug that could be triggered under specific conditions. A valid customer configuration change later triggered it, causing most edge nodes to return errors globally.",
    "fix": "Identified and disabled the triggering configuration, then patched the underlying bug. Improved detection and rollout safeguards for such latent conditions.",
    "source_url": "https://www.fastly.com/blog/summary-of-june-8-outage"
  },
  {
    "id": "aws-s3-2017-02-28-command-typo",
    "title": "AWS S3 us-east-1 outage from a mistyped command removing too much capacity",
    "date": "2017-02-28",
    "affected_services": ["s3", "dependent-aws-services"],
    "service_types": ["storage", "api"],
    "symptoms": ["S3 API error rates elevated", "dependent services impaired", "several hours"],
    "symptom_type": "error-rate",
    "error_signatures": ["S3 request errors", "capacity below threshold", "subsystem restart"],
    "error_pattern_category": "config-error",
    "root_cause": "During routine debugging an engineer ran a command with a typo that removed far more S3 subsystem capacity than intended, forcing a full restart of index and placement subsystems that took hours and impaired many dependent services.",
    "fix": "Restarted the affected subsystems and restored capacity. Added guardrails to the tooling to prevent removing capacity below safe minimums and to slow large capacity changes.",
    "source_url": "https://aws.amazon.com/message/41926/"
  },
  {
    "id": "aws-kinesis-2020-11-25-thread-limit",
    "title": "AWS Kinesis us-east-1 outage from exceeding an operating-system thread limit",
    "date": "2020-11-25",
    "affected_services": ["kinesis", "cloudwatch", "cognito", "dependent-aws-services"],
    "service_types": ["streaming", "api"],
    "symptoms": ["elevated Kinesis API errors and latency", "cascading failures in dependent services"],
    "symptom_type": "resource-exhaustion",
    "error_signatures": ["thread creation failure", "increased error rate", "increased latency"],
    "error_pattern_category": "thread-pool-exhaustion",
    "root_cause": "A small capacity addition pushed the number of threads in the Kinesis front-end fleet past the operating-system thread limit per server. Front-end servers began failing, and because many AWS services depend on Kinesis the impact cascaded widely.",
    "fix": "Rolled back the capacity addition and restarted the front-end fleet, then increased thread limits and re-architected the front-end to reduce per-server thread counts.",
    "source_url": "https://aws.amazon.com/message/11201/"
  },
  {
    "id": "aws-ebs-2011-04-21-remirror-storm",
    "title": "AWS EBS/EC2 us-east-1 outage from a re-mirroring storm after a network change",
    "date": "2011-04-21",
    "affected_services": ["ebs", "ec2", "rds"],
    "service_types": ["storage", "compute", "network"],
    "symptoms": ["stuck EBS volumes", "elevated latency and errors", "multi-day recovery"],
    "symptom_type": "resource-exhaustion",
    "error_signatures": ["volumes stuck re-mirroring", "control plane overload", "API throttling"],
    "error_pattern_category": "capacity-cascade",
    "root_cause": "A network configuration change during scaling routed EBS traffic onto a lower-capacity network. When the primary network was restored, a large set of volumes simultaneously tried to re-mirror, exhausting spare capacity and creating a self-reinforcing storm that overwhelmed the control plane.",
    "fix": "Throttled and manually recovered re-mirroring, added capacity, and prevented control-plane overload. Improved network change procedures and back-off in the re-mirroring logic.",
    "source_url": "https://aws.amazon.com/message/65648/"
  },
  {
    "id": "aws-seoul-dns-min-healthy-hosts",
    "title": "AWS EC2 DNS resolver outage from a config change removing minimum healthy hosts",
    "date": "2011-01-01",
    "affected_services": ["ec2-dns-resolver"],
    "service_types": ["dns", "network"],
    "symptoms": ["EC2 DNS query failures for ~84 minutes"],
    "symptom_type": "error-rate",
    "error_signatures": ["DNS resolution failures", "NXDOMAIN/timeout"],
    "error_pattern_category": "config-error",